{
  "protocolVersion": 1,
  "status": "completed",
  "reasonCode": null,
  "truncated": false,
  "content": [
    { "type": "text", "text": "Decrypted github.com/colonelpanic8." }
  ],
  "structuredContent": {
    "path": "github.com/colonelpanic8",
    "username": "colonelpanic8",
    "hasOtp": true
  },
  "secrets": {
    "password": { "value": "correct horse battery staple", "label": "Password for github.com/colonelpanic8" },
    "otp": { "value": "123456", "label": "Current one-time code for github.com/colonelpanic8" }
  }
}
